广告营销总监,武汉道森媒体股份有限公司,40-50万/年,上海-金山区,大专,2年经验,武汉道森媒体股份有限公司,广告,岗位职责1、在上级的领导和监督下定期完成量化的工作要求，并能独立处理和解决所负责的任务；2、协助上级管理、协调市场，跟踪并监察各项市场营销计划的执行；3、协助对公司产品的市场调研活动；4、负责公司的广告定期制作及宣传工作；5、收集市场同行业信息，参与策划有关公司产品的发布、展会等活动。任职资格1、大专以上学历，营销、管理类专业为佳；2、熟悉机械行业，有销售和管理经验者优先；3、具备思维活跃、有积极进取的精神及接受挑战的性格；4、为人诚实、正直，性格开朗、责任心强，擅长与人沟通；5、有一定的组织协调能力，能承担和突破工作压力，是很好的时间管理者和自我任务驱动者。,已上市  |  150-500人
营销副总经理,重庆车兔兔停车场管理有限公司,1.5-2万,西昌,大专,3-4年经验,重庆车兔兔停车场管理有限公司,房地产,职位描述：1、负责所在地的经销商相关产品的售卖与服务，完成公司制定的销售目标；2、宣传推广公司产品、品牌，负责新客户的拓展和开发，并维护和管理老客户；3、负责客户营销方案的制作和提报，以及销售合同的谈判、签订、收款；4、组织所在地用户和经销商的培训及活动。职位要求：1、大专及以上学历，有互联网、汽车、媒体等相关行业销售经验；2、诚实有信，做事坚持原则，有责任心，吃苦耐劳；3、热爱销售工作，有激情，积极主动，有强烈的团队协作意识；4、有创业心态，愿意投入付出。,民营  |  50-150人
营销顾问-汕头,字节跳动,8千-1.5万,杭州,本科,5-7年经验,扁平管理,互联网/电子商务,工作职责:1、管理统筹项目营销工作，负责案场流程的制定和落实；2、对案场策划、销售人员、销管等人员进行有效管理及专业培训；3、根据销售目标，确定项目年度和阶段性销售计划/推广策略/营销费用，控制项目销售节奏及实施；4、负责项目工作计划的制定、市场研究、前期准备、实施推进、监督检查等全过程管理工作，落实并分解工作目标，领导项目营销团队完成销售目标。任职资格:1、有区域内商业项目完整操盘经验，具备丰富的客户资源及客户拓展能力；2、有较强的组织管理、协调沟通能力，具有较强的责任心、抗压能力和团队合作精神。,民营  |  10000人以上
营销总/营销经理,上海蓝城置业有限公司,20-30万/年,,,,五险一金,房地产,,民营  |  50-150人
房地产项目营销经理,广州城投城市更新集团有限公司,1-2万,,,,五险一金,房地产,,国企  |  50-150人
营销总监,湖北欧宅新材料科技有限公司,25-40万/年,汕头,大专,3-4年经验,买保险,建筑/建材/工程,职位描述：1、负责所在地的经销商相关产品的售卖与服务，完成公司制定的销售目标；2、宣传推广公司产品、品牌，负责新客户的拓展和开发，并维护和管理老客户；3、负责客户营销方案的制作和提报，以及销售合同的谈判、签订、收款；4、组织所在地用户和经销商的培训及活动。职位要求：1、大专及以上学历，有互联网、汽车、媒体等相关行业销售经验；2、诚实有信，做事坚持原则，有责任心，吃苦耐劳；3、热爱销售工作，有激情，积极主动，有强烈的团队协作意识；4、有创业心态，愿意投入付出。,民营  |  150-500人
营销顾问,字节跳动,8千-1.5万,上海-徐汇区,大专,1年经验,租房补贴,互联网/电子商务,工作内容:A.557花园市场工作内容：1、负责协助公司市场营销策划，制定相关内容的活动营销方案及活动落地执行；2、依据营销策略，协调公司各个相关部门协作，做好营销工作及宣传方案；3、对抖音、点评等店定期监督内容，并提高导流执行方法；4、私域客户拓展、客户关系维护；小程序内容管理；B.威士忌达人会工作内容：1、私域客户拓展、客户关系维护；2、会员客户日常沟通；3、威士忌达人会的市场活动策划和执行推广；具备条件：1、大专或以上学历，有1年以上餐饮行业市场的从业经验优先2、熟悉新媒体运作模式；,民营  |  10000人以上
营销总监,广州白云新天地置业有限公司,1.2-2万,武汉-洪山区,大专,10年以上经验,购买社保,房地产,"岗位职责：1、负责公司线下电梯投影项目广告资源的区域性客户及客户价值梳理,并制定年度业务推进策略、政策、保证业务稳定推进,承担相应任务;2、根据公司需要制定并执行市场开发方案，带领销售团队完成公司下达的销售业绩目标；3、收集各渠道、竞争对手、消费者以及其他市场的信息，并将信息进行汇总、分析，定期做出市场动态评估，并反馈给公司总经理；4、负责公司线下梯影销售团队的管理；充分挖掘自身及团队工作潜力，完成公司的市场销售目标；5、建立同区域大客户的稳定合作关系,提升在业内影响力;6、通过机制建立有效把控广告投放风险。任职要求：1、10年以上广告行业经验，5年以上团队管理经验；2、熟悉互联网和新媒体，对传媒行业趋势敏感，具有丰富的客户资源和销售渠道；3、有丰富的户外、商圈、社区场景、影院的大型广告业务平台或大型广告代理企业从业经验;4、具有敏锐的市场判断能力、独立的谈判能力；5、善于激励并调动下属积极性，营造融洽的工作氛围。上班地址：徐东联发国际大厦",民营  |  50-150人
市场营销总监,广东云心测科技有限公司,8千-1万,,,,广东云心测科技有限公司,专业服务(咨询、人力资源、财会),,民营  |  少于50人
营销策划岗,浙江保利房地产开发有限公司,8千-1.5万・16薪,合肥,大专,3-4年经验,策划,房地产,职位描述：1、负责所在地的经销商相关产品的售卖与服务，完成公司制定的销售目标；2、宣传推广公司产品、品牌，负责新客户的拓展和开发，并维护和管理老客户；3、负责客户营销方案的制作和提报，以及销售合同的谈判、签订、收款；4、组织所在地用户和经销商的培训及活动；职位要求：1、大专及以上学历，有互联网、汽车、媒体等相关行业销售经验；2、诚实有信，做事坚持原则，有责任心，吃苦耐劳；3、热爱销售工作，有激情，积极主动，有强烈的团队协作意识；4、有创业心态，愿意投入付出；,国企  |  150-500人
营销顾问 ― 泉州,字节跳动,9千-1.8万,南通-启东市,大专,5-7年经验,弹性工作,互联网/电子商务,全面统筹负责整个项目的营销策划及生活服务工作，包括不限于以下：1、负责销售团队的组建、培养、考核等管理工作。2、收集并分析房地产行业信息、房地产相关政策法规、客户信息，并结合项目公司经营目标，制定营销目标和营销策略。3、根据营销目标，制定项目总体销售节奏控制方案和分阶段营销计划，根据市场和政策的变化适时调整销售节奏。4、有效组织实施各重大营销节点（如开盘、交付等）。5、做好客户社群的建设和运营，做好生活设计委员会的运营工作等。岗位要求：1.学历要求：大专及以上学历。2.专业要求：专业不限，房地产、市场营销优先。3.工作经验：8年以上房地产行业营销管理经验，2年以上同等岗位工作经验；具备完整房地产项目营销操盘经验，熟悉地市市场。4.能力要求：思维活跃、思路创新，敢于尝试新的营销手段和方法、学习能力强、执行力强。,民营  |  10000人以上
市场营销专员,韩国株式会社KT&amp;G北京代表处,1.5-2万,孝感,本科,10年以上经验,市场营销,快速消费品(食品、饮料、化妆品),岗位职责:1、负责统筹公司产品的市场开拓、客户管理及市场推广、营销过程的组织与监控，定期组织市场调研，分析市场动态，制订动态市场营销策略，确定目标市场，建立市场渠道结构贯彻执行公司的整体经营计划及锁定经营目标，2、结合公司年度经营业绩目标确定销售策略、市场策略、产品定价策略、销售渠道策略、促销策略和营销组合策略等。3、做好市场调查、分析和预测工作，拟定营销目标和计划，及时收集市场情报、竞争对手的经营动态和客户情报，以便获得更广阔市场，4、每月分析营销动态，市场发展趋势，找出存在问题，提出改进方案及措施，确保营销各项工作的顺利完成。5、定期走访客户，保持与客户的密切联系，同客户建立长期稳定的关系。6、负责公司重大项目的推进及落地:7、其他公司安排的工作。任职资格:1、本科或以上学历，10年以上相关工作经验，建材行业工作经验优先;2、有较强的市场销售管理技能，优秀的沟通协调能力和项目策划运作能力;3、具备战略思维，能全盘统筹营销中心，具有出色的领导能力、判断决策能力;4、具有强烈的事业心、创业精神和抗压力，执行力强，结果导向。,外资（非欧美）  |  50-150人
网络营销经理,武汉晒阳暖通设备有限公司,6千-1万,广州-越秀区,本科,5-7年经验,销售及管理,仪器仪表/工业自动化,职责描述：1、根据项目经营目标要求，制定项目年度销售计划并负责组织销售团队按计划实现；2、负责推进各专业部门与营销相关的具体工作的落实；制定项目年度营销费用计划；3、统筹协调项目内销售管理、策划执行相关工作的合理安排和关键工作，如开放、开盘、价格方案的制定；4、统筹协调项目营销团队、销售代理团队、广告策划团队的具体工作，确保各项工作有序开展。任职条件：1、大学本科及以上学历，市场营销、新闻传播学类、工商管理类、公共管理类等相关专业，持有房地产、财务、统计、经济等职称优先；2、了解广州房地产市场情况及资源情况，有大客户资源优先；3、具有6年以上房地产项目营销专业从业经验，至少独立操盘1个项目，或从事大型项目策划管理工作；4、掌握房地产市场销售管理等相关知识；掌握销售全流程及相关政策法规；掌握房地产销售数据分析技能；熟练使用日常办公软件；5、具有良好的文字功底和沟通、协调、执行能力。6、具备良好的道德品质和职业素养，有正常履行职责的身体条件和心理素质。,民营  |  少于50人
营销策划岗,浙江保利房地产开发有限公司,8千-1.5万・16薪,,,,策划,房地产,,国企  |  150-500人
营销顾问 ―红河,字节跳动,8千-1.5万,嘉兴,本科,10年以上经验,五险一金,互联网/电子商务,,民营  |  10000人以上
营销部经理,爱慕集团四川分公司,1.2-2万,,,,五险一金,服装/纺织/皮革,,民营  |  少于50人
网络营销总监,武汉晒阳暖通设备有限公司,6千-1.2万,淄博,大专,2年经验,销售及管理,仪器仪表/工业自动化,岗位职责：1、有一定的市场推广及宣传能力，熟练自媒体软件使用2、有较强的沟通能力，能独立挖掘市场信息数据及维护客户3、维护运营公司网站，公众号，网店等。岗位要求：1、大专及以上学历，市场营销等相关专业；2、反应敏捷、表达能力强，具有较强的沟通能力及交际技巧，具有亲和力；3、具备一定的市场分析及判断能力，良好的客户服务意识；4、有责任心，能承受较大的工作压力；5、有团队协作精神，善于挑战。4K起,民营  |  少于50人
营销总经理,湖北恒大置业有限公司,2.5-3.5万,,,,定期体检,房地产,,民营  |  150-500人
营销顾问 ― 合肥,字节跳动,8千-1.5万,广州-白云区,本科,8-9年经验,带薪休假,互联网/电子商务,1、负责项目总体策划，市场及产品定位，团队建设，客户关系管理，领导营销团队实现公司下达的营销目标。2、负责项目执行工作的组织、实施及效果评定。3、负责客户关系、媒体关系的维护与拓展，合理有效使用预算和市场推广活动。4、各项营销流程、制度的监督执行及优化。5、负责对项目营销人员的日常管理及绩效考核等部门内部管理工作。岗位要求：1、本科或以上学历，专业不限。2、5年或以上房地产营销工作经验，3年或以上管理经验，拥有全程营销策划经验。3、具备较强营销管理、客户管理、团队管理及建设能力，沟通与协调能力较强。4、熟悉城市建设、房地产行业，熟悉房地产国家相关法律法规，及时掌握房地产市场动态，具备敏锐的市场洞察力、判断力。5、高薪诚聘！,民营  |  10000人以上
营销专员,甘肃浪哩浪网络科技有限公司,6-8千,广州-南沙区,本科,1年经验,营销,互联网/电子商务,岗位职责：1.负责公司循环水养殖工厂养殖品的前期市场调研，制定试销方案；2.负责协助产品营销策略的定制，包括市场定位，竞品分析、市场营销活动等品牌建设活动；3.负责公司养殖品的销售，做好相应客户储备，拓展销售渠道；4.负责行业展会的策划、评估及执行，协助促销活动；5.追踪现有或潜在的市场需求，根据市场动态及客户心里，提炼产品概念，深挖营销路径，分析竞品，制作营销方案；6.对于公司鱼苗成鱼回收加班、渠道开发、销售渠道开发有相关工作经验。任职要求：1.***本科或以上学历，市场营销、工商管理、经济与贸易等相关专业，市场营销类相关专业优先考虑，年龄35周岁以下；2.具备良好的市场触觉及较强的观察力、判断力和应变能力；3.有良好的策略性、逻辑性强，较强的沟通能力、文字表达能力及信息获取整合能力；4.工作积极主动，有高度责任心，具备良好的团队协作精神、推动执能力。,民营  
国内营销管培生（23届毕业生）,广东志特新材料集团有限公司,5-7千,舟山,本科,3-4年经验,五险一金,建筑/建材/工程,1.负责制定并执行项目前期定位、中期热销、后期收官的全流程销售方案；2.负责检测市场动向，实时了解市场环境，制定市场报告及应对策略；3.负责与相关媒体对接，实施项目的品牌及文化的推广、宣传；4.负责项目内外部合作关系的协调，利用内外部资源，促成销售业绩达成；5.负责完成销售人员关于策划相关知识及价值点的培训；6.负责项目辅策的工作协调、统筹及培养。1.***本科学历；2.三年以上相关工作经验，有文旅项目经验优先。3.有极强的执行节点管控力，高度重视项目各维度执行落地；4.有能持之以恒的信仰感，强自我调节能力，能够带动团队活力,民营  |  1000-5000人
抖音视频营销,重庆云威科技有限公司,6千-1万,,,,短视频营销,互联网/电子商务,,民营  |  150-500人
营销顾问 ― 成都,字节跳动,8千-1.5万,,,,五险一金,互联网/电子商务,,民营  |  10000人以上
市场/营销/拓展专员/顾问,诺康方舟联合（武汉）国医养生馆,1-1.6万,,,,五险一金,生活服务,,民营  |  少于50人
市场营销部部长,榆林市三联商贸有限责任公司,1.5-1.8万,,,,团队管理,批发/零售,,民营  |  50-150人
项目营销总（派驻省外项目）,愿景集团,1.5-2.5万,肇庆,大专,3-4年经验,五险一金,房地产,职位描述：1、负责所在地的经销商相关产品的售卖与服务，完成公司制定的销售目标；2、宣传推广公司产品、品牌，负责新客户的拓展和开发，并维护和管理老客户；3、负责客户营销方案的制作和提报，以及销售合同的谈判、签订、收款；4、组织所在地用户和经销商的培训及活动。职位要求：1、大专及以上学历，有互联网、汽车、媒体等相关行业销售经验；2、诚实有信，做事坚持原则，有责任心，吃苦耐劳；3、热爱销售工作，有激情，积极主动，有强烈的团队协作意识；4、有创业心态，愿意投入付出；5、能适应出差。,民营  |  500-1000人
营销专员,浙江非攻机械有限公司,5-8千,天水,大专,1年经验,五险一金,机械/设备/重工,,外资（非欧美）  |  少于50人
营销顾问 ― 广州,字节跳动,8千-1.6万,重庆-渝中区,大专,1年经验,五险一金,互联网/电子商务,要求：1、热爱短视频行业，负责短视频营销、腾讯广告等产品的销售工作；2、18-32岁，具备优秀的沟通能力和较强的学习能力；3、有强烈的竞争意识，勇于挑战高薪；4、热爱销售，乐观向上，能承受一定工作压力；5、有短视频行业销售经验者优先；岗位职责：1、收集潜在客户资料，对象为所有企业级/商家客户；2、以线上电话沟通方式，了解客户所需产品意向；3、分析和挖掘客户对产品需求；4、约见和拜访客户；5、促进新客户合作签约，并维护现有老客户进行续费；销售晋升方向：销售顾问――销售主管――销售经理――大区经理――营销总监――副总经理周一至周五8:30-18:00，双休，国家法定节假日正常休息，并享受节日福利以及国家规定的婚假、丧假等。,民营  |  10000人以上
市场营销企划,法力藤国际贸易（上海）有限公司,8千-1万,,,,品牌宣传,贸易/进出口,,外资（非欧美）  |  少于50人
（内销）营销总监,卓艺集团,1.2-2万,廊坊,本科,3-4年经验,团队管理,影视/媒体/艺术/文化传播,职位描述：1、负责所在地的经销商相关产品的售卖与服务，完成公司制定的销售目标；2、宣传推广公司产品、品牌，负责新客户的拓展和开发，并维护和管理老客户；3、负责客户营销方案的制作和提报，以及销售合同的谈判、签订、收款；4、组织所在地用户和经销商的培训及活动。职位要求：1、本科及以上学历，有互联网、汽车、媒体等相关行业销售经验；2、诚实有信，做事坚持原则，有责任心，吃苦耐劳；3、热爱销售工作，有激情，积极主动，有强烈的团队协作意识；4、有创业心态，愿意投入付出。,民营  |  50-150人
市场营销专员,畅桥真空科技（浙江）有限公司,7千-1万,上海-浦东新区,本科,5-7年经验,五险一金,机械/设备/重工,1.制定全年全面的市场营销、销售活动的策划及执行方案和全年市场费用预算。2.负责规划公司品牌、产品市场定位、营销规划和发展战略，组织实施市场调研、评估和分析，及时掌握市场发展动态。3.负责组织公司新产品的前期调研、可行性论证；掌握季节核心商品，制定营销方案，根据市场行情，对商品的结构、包装、新品开发等提出改善建议。4.负责制定销售费用预算，引导和控制市场销售工作的方向和进度，合理分配和控制销售成本；整合资源，健全销售管理体系，优化销售管理流程；制订切实可行的销售拓展计划。5.负责完善客户关系管理体系，做好客户维护计划，并督导有效实施，及时掌握实施进度及情况，做好管理和协调。6.负责做好重要客户商务会谈的策划安排及合同签订。7.根据公司的发展战略及市场布局计划，负责各区域的业务团队组建、补充、发展和培养工作。8.负责督导各区域业务开展情况，加强对下属进行产品概念、市场情况、产品陈列的指导，增强产品的展示效果，发现问题，及时提出改善方案等。任职要求：1.教育背景：企业管理或市场营销专业本科（统招）以上学历；2.年龄：30-45周岁；3.工作经验：具5年以上市场营销管理工作经验等；4.工作能力：具有敏锐的市场洞察力和全渠道开发及营销的能力；5.个人素养：具备良好职业素养、敬业、正能量、责任心强、团队合作精神。,民营  |  少于50人
营销顾问 ― 西昌,字节跳动,8千-1.5万,,,,扁平管理,互联网/电子商务,,民营  |  10000人以上
项目营销负责人（商办类）(J11124),众安集团有限公司,1.5-2.5万,广州-天河区,本科,2年经验,五险一金,房地产,岗位职责：1.主动制定营销策略：结合业务发展目标，主导制定符合本地市场的整合营销策略，确保当地营销策略与公司整体营销目标一致；2.与全球营销团队协调：与总部营销团队和国家经理协作，确保当地营销策略与公司整体营销目标一致；3.发展合作伙伴关系：建立并维护与当地行业协会、意见领袖的关系；4.策划，管理和指导本地营销活动：策划及实施本地营销活动，包括规划和管理预算，选择有效的媒体推广渠道以及衡量活动成功与否，同时指导本地代理商执行和优化活动，（海外出差机会较多）；5.深入了解当地市场：了解当地市场趋势，客户行为和竞品情况，进行海外软件市场调研分析，竞品信息搜集及分析，指导营销策略调整。6.分析营销成效：跟踪和分析营销活动的成效，以确定需要改进的地方并确保公司其营销目标。岗位要求：1.大学本科或以上学历，或有海外留学经历，英语听说读写良好，CET6以上；2.理工科专业优先，或者有小语种优势的优先；3.2年以上B2B营销工作经验，对软件产品营销有兴趣；4.有东南亚市场出海营销经验者优先；5.逻辑思维清晰，有良好的数据整理和分析能力；6.有热情，思维灵活，有强烈的责任心和抗压能力，有创新精神。,民营  |  1000-5000人
市场营销助理,林迪（宁波）电子有限公司,8-10万/年,,,,五险一金,通信/电信/网络设备,,外资（欧美）  |  少于50人
市场营销经理/主管,深圳市威立印技术有限公司,1.8-3万・13薪,深圳-宝安区,本科,5-7年经验,员工旅游,仪器仪表/工业自动化,岗位职责：1-依据公司整体战略，制订市场部年度、季度、月度营销策略与计划，并推行达成各项目标。2-负责市场部门团队建设、部门管理，优化部门工作流程，完善营销体系，健全部门规章制度，并督导执行3-负责市场与行业调研分析，制定市场的经营规划、客户群分析与，为公司整体销售活动作全盘计划4-负责塑造产品品牌形象，收集客户、同行之资讯，分析并拟订品牌及行销战略计划，使公司品牌美誉度提高，占有率提升5-负责市场部整体人才梯队建设规划，并督导实施，使属下部门及员工提升自身素质及技能6-负责电商、官网等各类媒体、画册、宣传渠道的建设与实施，负责产品与供应链梳理、产品方向与销售策略的规范与完善；7-负责制定部门员工的绩效考核方针及实施，根据实际情况调整考核目标和内容任职要求：1-工商管理、市场营销、自动化等专业本科学历；2-5年以上营销与市场团队统筹管理经验，有工控产品行业同职位经验；3-精通SEO、SEM、电商平台（淘宝、阿里巴巴）、抖音运营；4-具备成熟悉的团队管理经验，擅长打造积极、高效的营销团队；5-具备市场调研、分析与推广；品牌建设与打造的优秀能力。6-具备产品整合、销售战略策划与实施的能力，带领营销团队达成公司各项营销各阶段的目标。,民营  |  50-150人
营销顾问-汕头,字节跳动,8千-1.5万,,,,扁平管理,互联网/电子商务,,民营  |  10000人以上
市场/营销/拓展专员,上海利鼠和荣文化传播有限公司,7千-1万,,,,客户关系维护,广告,,民营  |  少于50人
