市场营销总监,上海西郊庄园资产经营管理有限公司,2.5-3万,上海-闵行区,本科,5-7年经验,五险一金,房地产,岗位职责：1.在总经理的领导及管理下，对市场营销活动的各个方面进行监督和指导。具体责任包括：监督促销战略的计划及发展和市场计划；监督和参与市场营销计划的发展和执行；管理市场营销队伍和报告计划执行的效果；职责还包括需要同地区性的市场营销办公室进行直接和日常例行的沟通。2.制定年度营收计划，市场预算和预测3.制定有关于营收计划的执行计划以确保营收计划目标得以完成；4.协调一切可用于维持和增长业务量的方式，包括：广告促销，个人销售，公众及社会关系，特价销售等等5.保持与酒店外部个体的互动交流，这些包括（但不仅限于）：客户，常规机构，本地的酒店联合协会，政府旅游办公室，航空公司，旅行社，旅游经营者，竞争者以及其他的本地社会团体成员6.调查潜在的市场通过回顾销售部门和前厅部门的相关资料，分析客史档案和入住资料，研究顾客的调查问卷，回顾政府部门关于城市旅游人员的统计调查，分析竞争对手的销售及促销方案，研究销售方面相关的行业出版刊物，通过分析过去广告活动产生的市场效应和咨询其他部门的领导及广告机构，向总经理推荐能为酒店获取***效应的广告方式。7.通过保持与航空公司，旅游中介，商业机构，私人俱乐部以及在社会团体和接壤的市场中的专业协会的联系，来为酒店获得新的和重复业务；8.定期回顾社会公共关系活动以确保酒店在本地和国家媒体中有较高的认知率；9.管理新的产品和服务的发展；10.监督新的市场战略的发展；岗位要求：1、市场营销、企业管理、酒店管理等相关专业本科及以上学历；持有酒店职业经理人等相关证书者优先考虑；2、具有6年以上酒店市场销售管理工作经历；具有同等职位工作经历3年及以上，国际品牌五星级酒店工作经历；3、拥有良好的社会关系和人脉，对上海市场有深刻的认识和理解，敏锐的市场分析能力；自身拥有很强的市场开拓能力，并有具有很强的管理能力带领市场销售团队。4、英语听说读写流利，沟通能力强；熟练的办公软件操作能力；5、具有一线城市五星级酒店工作经历优先。,合资  |  少于50人
项目营销经理-成都,华润置地华西大区总部,1.8-3万・16薪,成都-成华区,本科,8-9年经验,定期体检,房地产,岗位职责:1）负责项目团队组建、营销工作计划编制，***高去化实现；2）负责制定项目年度、月度营销策略、销售计划、费用计划、定价策略；3）负责客户梳理、完成项目月度、年度的销售、签约、回款目标；4）负责收集政府相关职能部门政策变化信息；5）负责销售物料、销售说辞等对外资料的审核，把控销售风险；6）负责项目营销团队人员管理。任职要求:1）本科及以上学历，房地产经营、市场营销、管理相关专业优先；2）具有8年及以上工作经验，具备大型房地产企业同类型岗位工作经验优先；3）熟悉国家房地产政策，具备相关法律法规等方面的知识，有完整的项目操盘经验；4）结果导向，良好的沟通协调能力、抗压能力、执行力、问题解决能力。,国企  |  500-1000人
市场营销总监（龙华8号仓） (MJ000149),深圳市八号仓奥特莱斯有限公司,2-3万・17薪,深圳-龙华区,本科,5-7年经验,五险一金,物业管理/商业中心,【岗位职责】1、根据公司发展战略目标，全面负责项目市场推广建设及部门团队管理工作；2、制定年度市场活动预算与计划，监督实施并评估市场效果与预算执行情况；3、收集行业信息，掌握市场动态，分析销售和市场发展状况，结合项目现状制定市场营销战略；4、负责各项经营活动和促销活动，塑造企业形象，提高企业知名度和美誉度；5、企业内外形象设计、宣传统筹，完成项目统筹计划年度内各档周年庆等活动；6、负责项目新媒体的传播，带动相关部门及品牌大型曝光类线上引流活动；7、负责对项目内进行企划赋能，结合公司战略规划提出可行性建议；8、制定部门内部工作规范、行为准则及奖励制度，指导、检查、控制本部门各项工作的实施；9、完成上级领导交办的其他工作。【任职要求】1、本科以上学历，市场营销、工商管理等相关工作经验；2、五年以上大型商业项目市场策划负责人岗位工作经验，三年以上同岗位管理经验；3、熟悉商业地产、奥莱业态、零售行业市场推广策划工作。,民营  |  150-500人
营销策划经理,上海优智者科技有限公司,1-1.5万,上海-松江区,大专,2年经验,营销策划,建筑/建材/工程,1、负责消费者需求洞察、用户研究工作2、负责行业市场容量、竞争格局调研3、负责公司产品的营销推广卖点提炼、文案策划、终端陈列、演示等策划工作4、负责新品上市、促销推广等策划与落地方案制定工作；5、定期总结复盘策划、执行、结果与优化方案；任职要求：1、大专及以上学历，熟悉浴霸吊顶、照明、电工等建材行业；2、建材行业营销策划工作经验2年以上；,民营  |  50-150人
新能源数字营销主管（广汽埃安）,成都北星埃安汽车销售服务有限公司,9千-1.3万,成都-新都区,大专,1年经验,汽车,汽车,"岗位职责：1、负责监管DCC人员每日电话接听2、积极完成每月个人及团队销售任务3、完成销售副经理下达的销售任务4、DCC人员日常管理5、积极配合销售部其他销售工作事宜任职资格：1、大专以上学历2、汽车相关专业或营销、市场营销管理3、3年以上相关销售经验4、熟练使用WORD,EXCEL等办公软件，具备基本的网络知识，驾驶技术熟练5、具备良好的团队合作精神；较好的沟通技巧，良好的心态；较强的执行力；专业的服务意识",民营  |  少于50人
市场营销经理,纽奶乐乳业（中国）有限公司,1-1.5万,深圳,大专,2年经验,市场活动策划,快速消费品(食品、饮料、化妆品),岗位职责：1、根据公司营销规划，建立完善公司的线下动销活动、产品推广等工作，针对不同类型的宠物店特点制定制定和组织实施相应的营销推广活动；2、落实公司的市场开拓活动计划，指导市场活动以及主题促销活动的制定和实施；3、负责收集、分析市场信息，进行市场预测及分析，包括市场动销活动情况及行业发展动态等，及时为公司决策提供依据；4、跟进及维护市场资源合作关系，包括当地宠物店、分销商等客户，日常拜访维系，稳定和促进公司产品销量；5、后期独立负责1~2各省份的市场动销活动执行。任职要求：1、大专及以上学历，行业内经验不限2、有丰富的市场活动策划及客情维护经验3、具有良好的客户服务意识，较强的宣传活动组织能力4、沟通良好，执行力强,外资（欧美）  |  150-500人
营销经理（重庆）,北京市建国伟业防水材料有限公司,5-10万/年,重庆-九龙坡区,大专,1年经验,北京市建国伟业防水材料有限公司,原材料和加工,岗位职责：1.根据集团总体市场方向和销售任务指标，配合完成本区域市场年度销售任务；2.开发、维护、区域代理商和核心客户，辅助其完成市场推广工作；3.配合区域总经理或独立开发防水工程项目；4.收集和了解当地防水竞争品牌市场动态，及时向总部反馈并提出建议意见；5.负责区域工程服务团队日常工作的统筹管理；6.服从集团公司总部日常统一管理，传达和执行集团公司的各项指令；7.完成集团公司安排的其他工作事宜。任职要求：1.专科及以上学历，男女不限；2.具有建筑工程、防水类相关产品行业销售经验及客户资源者优先；3.有较强的业务推展能力、具备较强的再学习沟通能力、善于维系客情关系；4.人品端正、品德良好，具有良好的团队合作能力；5.熟练机动车驾驶，可适应阶段性出差。,民营  |  150-500人
营销总监,湛江市正裕房地产开发有限公司,50-80万/年,湛江-坡头区,大专,10年以上经验,房地产,房地产,任职要求：1、学历要求：市场营销、房地产经营与管理类或相关专业专科及以上学历；2、工作经验：5年以上房地产大中型房地产公司同等职位工作经历，8年以上房地产项目全程营销策划管理工作经验；3、职业技能：熟悉房地产开发公司营销、策划全过程，熟练操盘自销+渠道联合销售模式。5、素质要求：卓越的规划、组织、策划、方案执行和团队领导能力，具有敏锐的市场洞察力和分析判断力，较强的创新意识和综合分析能力；较强的管理团队、培养人才、整事资源，具备良好的沟通和协调能力、谈判技巧、抗压能力及诚信度。6、薪酬福利：年薪50W~100W(底薪+佣金+奖金）+六险一金+节日福利+油补+通信补贴工作地点：湛江市坡头区奥体中心附近,民营  |  50-150人
营销总监（环保工程）(J10172),湖南博世科环保科技有限公司,20-40万/年,长沙-岳麓区,大专,10年以上经验,销售,环保,工作职责:1、执行公司销售政策，开展销售工作，巩固开拓业务市场；2、利用相关渠道和资源，开拓、建立、维护与客户的良好关系；3、及时收集、整理、归纳市场行情以及行业内的动态等信息资料，获取项目信息；4、业务领域为：水、土领域的环保工程，包括但不限于市政污水、乡镇污水、农环、土壤修复、工业水处理、重金属污染治理、水处理设备供应、固废等项目5、业务区域：湖南任职资格:1、有环保行业市场经验，能够迅速与目标客户建立起联系；2、有过全过程跟踪项目并落地的经验；3、有自身资源者***。,国企  |  150-500人
营销经理,三一重卡,8千-1.5万・13薪,长沙-长沙县,大专,3-4年经验,五险一金,机械/设备/重工,岗位职责：1、通过公司渠道提供的优质客户资源，拜访客户，维护客情2、提供给客户快速、准确、专业有品质的销售服务，确保客户满意；3、及时全面地向客户提供良好的客户服务，保持长期合作关系；4、负责公司新能源重卡大客户营销职位要求：1、***大专及以上学历；2、学历能力佳，普通话表达流畅，具有良好的沟通能力；3、积极勤奋、抗压力强，情绪管理能力强；4、有工程机械、汽车销售经验优先；,民营  |  500-1000人
市场营销部经理,武汉新立绿动科技股份有限公司,1-1.5万,武汉-洪山区,大专,3-4年经验,补充医疗保险,新能源,,合资  |  10000人以上
营销经理,安徽喜尔美企业管理有限公司,7千-1.4万,合肥-高新区,大专,5-7年经验,节日福利,计算机服务(系统、数据服务、维修),1.年龄25-45岁，男女不限，大专及以上学历。2.有销售相关工作经验五年以上。3.具有较强的洞察能力、分析能力和语言表达能力。,民营  |  50-150人
市场/营销/拓展总监,广州裕申电子科技有限公司,1-1.5万,广州-荔湾区,大专,3-4年经验,销售,计算机服务(系统、数据服务、维修),岗位职责：1、根据公司总体战略，结合市场情况制定销售策略与规划并组织实施，达成销售目标；2、进行客户分析，挖掘用户需求，开发新的客户和新的市场领域，完成销售计划及回款任务；3、负责销售团队的建设和成长，培养专业的销售团队，建立销售团队激励机制，激发销售人员进行客户开拓和维护；4、建立客户数据库，了解不同规模用户的现状与可能需求，并积极跟进；5、及时掌握市场行情，做好市场的调查和预测。任职要求：1、30-45，大专以上学历，有良好的职业操守，品行优秀，综合素质高；2、有PCB行业销售管理经验，有一定的客户资源；有相关行业的设备销售或者材料者优先；3、协调能力强，表达能力强，具备较高的商务处理能力；4、具有较强的市场开拓与销售技能；5、具备优秀的沟通能力和团队合作精神。,民营  |  50-150人
营销经理,三一重卡,8千-1.5万・13薪,长沙-长沙县,大专,3-4年经验,五险一金,机械/设备/重工,岗位职责：1、通过公司渠道提供的优质客户资源，拜访客户，维护客情2、提供给客户快速、准确、专业有品质的销售服务，确保客户满意；3、及时全面地向客户提供良好的客户服务，保持长期合作关系；4、负责公司新能源重卡大客户营销职位要求：1、***大专及以上学历；2、学历能力佳，普通话表达流畅，具有良好的沟通能力；3、积极勤奋、抗压力强，情绪管理能力强；4、有工程机械、汽车销售经验优先；,民营  |  500-1000人
营销经理,江西鼎峰装备科技有限公司,1-2万,九江,高中,2年经验,五险,机械/设备/重工,负责地区的消防类产品的销售工作,民营  |  50-150人
销售代表/市场营销,湖南新环境网络科技有限公司,5千-1万,长沙-芙蓉区,03-07发布,无需经验,节日福利,房地产,湖南新环境集团总部直招不收费，全长沙就近安排工作，提供免费住宿！有意向可直接联系，可优先安排面试，当天面试当天出结果。一、福利待遇：1）底薪3000+提成（10-45%）+五险+工龄工资+生日带薪假期+节日福利+开单奖励+带薪培训+境内外旅游+公司其他福利待遇（平均月薪5000-8000）2)奖励体系：新人奖、月度奖、季度奖、年度奖、精英大礼包、团队奖等众多奖励（包含实物奖、现金奖、旅游奖）；3)员工活动：聚餐、郊游、K歌、爬山、采摘、农家乐、足球篮球赛...4）我们的提成比例举例说明：假如你租出去一套月租2000的两房，公司就需收客户1000，房东1000（房东客户各自出个月月租的50%）的服务费，成为你的业绩，也就是2000，我们提成40-45%（业绩累计5000及以上按45%，以下按40%），也就是收入800-900元一套。如果一天成交两套3000的租房，可获得2400元的收入。5）工作时间：每天8:30上班，18:00下班，午休两小时，***，可自由安排；6）住宿需求：3房2厅精装宿舍家电齐全，可步行上班7）工作地址：长沙市860家门店皆可就近安排8）面试结果：当天面试，当天分配，当天可出结果，24小时内可安排住宿。二、任职要求：1）年龄18-45岁，男女不限，学历不限；2）毕业生，***，销售意愿强者可适当放宽条件；3）具有良好的学习能力及语言表达能力，要求较强的团队精神；4）热情上进，无房产经验也可，公司提供全面的培训三、岗位职责：1）负责搜集整理公司房屋及客户资源以及运营房源网站、发布房源信息；2）负责接待网络客户或上门客户，并根据客户需求提供房屋买卖或租赁等服务；3)负责带客户看房以及售后过程服务；4)负责做好老客户关系的维护，并保持有效的跟进。,民营  |  10000人以上
电话营销,湖南江海环保实业有限公司,6千-1.2万,,,,五险一金,石油/化工/矿产/地质,,民营  |  50-150人
营销经理,三一重卡,8千-1.5万・13薪,,,,五险一金,机械/设备/重工,,民营  |  500-1000人
市场营销助理,陕西天汇电力建设工程有限公司,4.5-6千,,,,市场营销,电气/电力/水利,,民营  |  50-150人
营销科学产品运营-解决方案,字节跳动,1.5-3万,北京,本科,3-4年经验,下午茶,互联网/电子商务,职位描述：1、负责字节跳动营销数据产品的落地和客户引入：通过与客户的共建，落地营销数据产品解决方案和各行业不同的数据营销模式；2、配合协作团队，结合实际业务场景，识别匹配机会点，梳理并落地解决方案及优化方向；3、针对客户使用情况，分析使用和投放效果，通过精细化运营，沉淀输出方法并提出优化产品建议；4、建立行业标杆case，通过内外推广扩大影响力。职位要求：1、本科及以上学历，3-5年以上营销/广告解决方案经验、对行业客户的营销及广告有认知，有市场咨询研究/广告营销公司、互联网saas/商业产品和甲方数字营销背景优先；2、良好的逻辑思维能力、客户沟通、需求判断和协调能力；3、有高效的沟通能力，有团队合作精神与大局观。,民营  |  10000人以上
市场营销总监,甘肃浪哩浪网络科技有限公司,10-15万/年,天水,本科,2年经验,市场规划,互联网/电子商务,,民营  
营销经理,三一重卡,8千-1.5万・13薪,长沙-长沙县,大专,3-4年经验,五险一金,机械/设备/重工,岗位职责：1、通过公司渠道提供的优质客户资源，拜访客户，维护客情2、提供给客户快速、准确、专业有品质的销售服务，确保客户满意；3、及时全面地向客户提供良好的客户服务，保持长期合作关系；4、负责公司新能源重卡大客户营销职位要求：1、***大专及以上学历；2、学历能力佳，普通话表达流畅，具有良好的沟通能力；3、积极勤奋、抗压力强，情绪管理能力强；4、有工程机械、汽车销售经验优先；,民营  |  500-1000人
营销专员,江苏悟飞能源科技有限公司,1-1.2万,无锡-滨湖区,03-07发布,1年经验,江苏悟飞能源科技有限公司,新能源,一、岗位职责1、负责客户的开发、维护所辖区域销售渠道资源和终端客户资源;2、做好本区域客户的收集、统计工作，并且能够有意识的对客户进行分析分类，有效跟进;3、结合公司指标，制定个人业绩目标以及销售计划;4、负责与客户签订销售合同，并督促合同正常如期履行;5、收集、分析所辖区域竞争厂家信息，制定合理的营销计划;6、遵守公司各项制度。二、岗位要求1、有相关销售方面的经验2、能接受出差3、能独立开车4、沟通能力强,民营  |  150-500人
营销科学产品运营-解决方案,字节跳动,1.5-3万,,,,下午茶,互联网/电子商务,,民营  |  10000人以上
AO史密斯社区营销人员,南京持盈贸易有限公司,5千-1万,南京-雨花台区,大专,1年经验,五险一金,家具/家电/玩具/礼品,负责区域内公司产品在小区渠道的调研、开发及销售工作，能充分理解并有效复制公司社区化商业模式，服务客户，树立良好的公司形象及产品口碑；负责公司已开发新老小区新老用户的维护：做好定期、不定期拜访、推荐产品合作、及时处理小区业主群内产品答疑、产品知识宣传等工作，培养核心铁用户，深挖客户需求，寻找二次销售机会及服务；负责公司已签约小区物业的工作维护：小区驻点、小区落地活动的对接与实施，保持与物业人员的沟通黏性，拓展销售机会点；除公司已开发小区及物业外，能有效拓展楼盘资源，拓宽业务渠道、具有收集行业信息并定期进行转化；岗位要求：***，20-35岁；大专及以上学历，条件优秀者可放宽至高中；有小区拓展或者家电销售经验优先；吃苦耐劳，思维灵活，爱学习，能不断创新不断改变的市场经营模式，并适时改变自己的销售方式；,民营  |  150-500人
营销经理,三一重卡,8千-1.5万・13薪,,,,五险一金,机械/设备/重工,,民营  |  500-1000人
全链营销中心高级总监（新媒体方向）-东风凌悦,东风汽车集团股份有限公司,3.5-4万,,,,五险一金,汽车,,国企  |  10000人以上
养老社区营销专家,杭州灏沫信息咨询服务有限公司,40-80万,,,,五险一金,贸易/进出口,,外资（非欧美）  
资质咨询营销总监,湖北平安之星科技有限公司,9千-1.8万,武汉-江汉区,大专,5-7年经验,销售总监,建筑/建材/工程,岗位职责：1、根据总经理的全年工作计划，确定资质营销部门的经营总目标及分解目标、制定营销部门管理方案及部门薪酬提成体系，业务开展过程中执行及完善部门营销方案和管理制度。2、负责带领、指导营销部门在武汉市场、湖北省各地州市开展资质咨询、合作业务的市场开拓。3、全过程指导营销部员工进行资质业务营销工作，奖优汰劣，带领团队完成部门经营目标。4、指导业务人员通过电话、微信、网络、商情信息、拜访面谈等方式，对资质咨询、合作需求客户提供个性化的咨询合作服务，定期的对客户进行回访、沟通，提高客户与公司、业务人员的粘度及合作深度。5、对所属部门的客户进行维护，使营销部实现安防、弱电、智能化、网络系统集成、消防、市政、机电、道路照明等工程企业客户、系统集成客户、行业产品供应商的开发与合作纵深拓展。积极维护行业内大客户、核心客户的客情关系，达成长期的资质咨询合作，促进业务的可持续发展。6、收集并主导分析、反馈行业客户信息、行业市场情报，挖掘客户需求，协助部门人员完成个人业绩目标，达成公司年度业绩目标。5、在本部门内进行客户资源分配，指导各团队成员开展有效的咨询服务工作，带领各团队完成所属部门分配的业绩任务。6、完成公司总经理安排的其他工作任务。薪酬结构：1、底薪+个人业绩月度提成+年终奖+月度销冠奖+部门管理提成（总提成比超20%）任职要求：1、有安防、消防、建筑工程、安防、消防、智能化器材营销行业营销总监五年以上工作经验或建筑行业资质咨询、合作3年工作经验人员重点录用。2、大专及以上学历，思维逻辑性强，思维敏捷，口齿清晰。能熟练使用Word、Excel办公软件。3、有较强的学习能力与优秀的沟通能力及50~100人团队管理能力，对销售工作有较高热情。3、有良好的应变能力、承压能力，性格坚韧，工作态度积极，事业责任心强。4、有安防、消防行业工作经历，熟悉并了解资质咨询合作，有实操工作经验者优先录用，重点培养及快速晋升。,民营  |  少于50人
营销策划（双休）,赛恩福兹（广州）食品科技研究院有限公司,6千-1万,,,,营销,快速消费品(食品、饮料、化妆品),,民营  |  少于50人
市场营销总监,陕西中勉投资有限公司酒店管理分公司,1-2万,,,,带薪年假,酒店/旅游,,国企  |  50-150人
新零售营销总监,江苏喜上喜食品有限公司,1.8-2.5万,南通-海安市,大专,5-7年经验,五险一金,快速消费品(食品、饮料、化妆品),岗位职责：1、根据公司业务目标及规划，制定新零售板块的战略、业务目标及销售运营计划；2、独立负责线上新零售渠道规划、开发及运营，包括直播电商、社群电商、社交电商等销售平台的合作，以完成整体销售目标；3、协同公司其他部门建立并管理公司在新零售板块的整体规范，包括形象视觉体系、消费者评价体系、忠诚度会员体系等；4、建立新零售板块用户服务体系，根据新零售产品运营数据，不断优化行动方案以提升业务核心指标；5、负责统筹协调本部门工作（运营、推广、设计、客服），设定合理的KPI并做好团队的人才搭建、管理、培养等，建立高效的团队，并打造有效的团队协作机制；岗位要求：1、大专及以上学历，28-35周岁，5年以上相关经验，思维活跃，有较强的沟通、协调、谈判、业务拓展及渠道销售能力；2、熟悉微商、团购、直播、视频号等新零售的运作模式，具备新零售运营项目（小程序、短视频、直播等）成功案例积累，具有创新精神；3、熟悉直播及新媒体非平台性渠道的合作方式及推广办法；4、有食品、快消品行业经验，私域运营为主，公域运营为辅；5、具备团队管理经验和能力，具备出色的逻辑分析能力和沟通表达能力。,民营  |  少于50人
网络营销专员,淄博沃泰斯石化设备有限公司,4-5千,淄博,大专,无需经验,公众号推广,机械/设备/重工,,民营  |  少于50人
市场营销专员,珠海惠友电子有限公司,6-8千,,,,销售,电子技术/半导体/集成电路,,民营  |  50-150人
营销策划专员（周末双休）,广东乐天控股集团有限公司,7千-1万,,,,营销策划专员,物业管理/商业中心,,民营  |  150-500人
