市场营销,山东凯棠医疗科技有限公司,4-5千,成都-温江区,大专,5-7年经验,消化道内窥镜,医疗设备/器械,岗位职责：根据公司战略目标，制订所负责区域全面规划、目标分解、完成任务的保障措施及从事所负责区域内销售工作，能够收集负责区域内有效工程信息，建立所在区域市政项目资源，同时能够利用区域资源整合项目、达成合作；2、根据本区域内各目标客户群的需求分析及公司年度销售计划，保证实现本区域的市场占有率和销售目标；3、能够接受并能完成规定的销售任务；4、根据公司业务发展需要，安排所辖区域重要客户到公司考察、参观交流，建立顺畅的沟通渠道；5、及时处理客户异议和投诉，以提高客户满意度，建立长期、良好、稳固的区域客户关系；6、对公司所操作的项目成本和风险进行控制，做好公司内部协调以及公司外部资源整合。7、服从并完成公司及领导下达的各项工作安排。任职要求：1、大专及以上学历，年龄30-45岁，市场营销、工商管理等相关专业，有5-10年以上相关销售经验，会驾驶，适合省内外出差；2、具有果断的决策、沟通、协调、激励能力，风险意识强和敏锐的市场洞察力、应变能力、创造性的思维能力；3、遵守公司管理制度，服从安排，无不良工作记录或政治、财务纠纷问题；4、本人***，阳光朝气，穿着得体，谈吐条理清晰，语言表达能力强，积极乐观向上，有极强的抗压能力和心态调节能力和极强的工作责任感、忠诚度、保密意识及坚韧不拔的毅力、耐心；5、有相关政府资源者优先；6、投递者和应聘者，电子简历和应聘登记表，请附上近期免冠照片，如无照片者，将视为无效求职简历处理。,民营  |  少于50人
营销储备人才,宜昌稻香隆商务信息咨询有限公司,8-10万/年,广州-越秀区,本科,5-7年经验,驻外,快速消费品(食品、饮料、化妆品),,民营  |  10000人以上
抖音盒子-电商活动营销,字节跳动,3-4.5万,广州,本科,5-7年经验,下午茶,互联网/电子商务,岗位职责：一、业务管理：1、根据公司整体发展战略，制订公司营销战略；2、设计销售模式，制订销售计划，对公司销售业绩负责；3、主持公司重大销售合同的谈判与签订工作；4、对销售情况及时汇总、汇报并提出合理建议；5、负责销售款项及时收回，防止呆账坏账，保证资金周转；6、负责处理大客户投诉，跟踪投诉处理结果，并进行客户满意度调查；7、严格控制销售费用，节约开支，降低销售成本；8、销售渠道的拓展与维护；9、协助团队成员进行重点客户开发；10、完成总经理临时交办的工作。二、制度与流程建设：建立、健全营销部各项规章制度和流程，推动公司营销管理的规范化和不断进步。三、团队建设：负责营销部组织架构规划与管理，销售人员的招募、培训和日常管理。任职要求：1、本科及以上学历，机械类、自动化类专业优先；2、有极强的沟通表达能力、商务谈判能力、抗压能力；3、品行端正，极强的的责任心，良好的团队合作精神；4、5年以上自动化设备行业营销岗位工作经验，5年以上营销团队管理经验；5、极强的的市场分析和洞察能力，能敏锐的把握市场动态；6、拥有半导体行业、芯片行业、面板行业丰富的客户资源。,民营  |  10000人以上
营销策划专员,广州市钱大妈农产品有限公司,8千-1.2万,苏州-吴中区,本科,3-4年经验,市场营销,快速消费品(食品、饮料、化妆品),"一、工作职责：1、制定并执行相应产品市场发展策略；2、收集、分析和评估市场趋势、客户需求、竞争伙伴相关活动识别市场机会、调整市场策略和市场计划及时应对市场和竞争的变化；3、与团队紧密合作，对制定的目标市场进行探索，提出新产品的开发的方向和建议；4、通过自身资源、公司渠道、展会及交流会等机会，寻求与目标客户合作的机会；5、负责对于新产品上市后的生命周期管理及反馈追踪，包括产品的改进，产品线的延伸及淘汰等。二、任职资格：1、	本科以上学历，专业不限；2、	受过市场营销、销售技能、财务知识等等方面的培训，3年以上市场营销工作经验。3、	对复合材料应用市场有一定的了解；4、	具备较强的营销、推广能力和良好的人际沟通、协调和解决问题的能力。5、	具有战略前瞻性和大局观，有强烈的事业心和工作热情；",民营  |  5000-10000人
营销总助,蔻彩环保科技（上海）有限公司,1-1.5万・13薪,湖州,大专,5-7年经验,销售助理,建筑/建材/工程,"岗位职责：1、	编制相应的市场开发计划、审核并执行2、	定期组织开展市场调研工作，实时掌握市场动态，完成市场分析并制定相应的市场策略3、	编制市场拓展各项费用预算，并控制相关费用的支出4、	目标市场的谈判与合作5、	团队建设与管理",合资  |  50-150人
市场营销经理（泾阳路）,上海盟易信息科技有限公司,2.9-3万,惠州-惠东县,大专,5-7年经验,五险一金,贸易/进出口,岗位职责：1.负责针对聚焦市场进行市场调研，形成有效的调查报告，以供决策分析2.动态收集和分析行业的发展动态和国家政策，提供外部环境分析3.协同销售部作市场的定位、竞争对手调查以及企业分析。4.协同销售部制定市场策略和竞争策略5.参与市场推广的活动，如展会，行业论坛等6.参与主要客户的拜访，掌握行业和客户需求变化7.参与制定并执行市场推广方案，包括传统媒体和新媒体，包括网络推广、展会、论坛、新媒体等多种渠道的结合。8.负责协助销售团队日常管理、监督、指导、培训工作；9.协助监督及管理团队成员工作，针对性地给予支持和帮扶；任职资格：1、***大专及以上学历，营销或者销售相关专业2、5年以上BtoB企业营销或销售的工作经验3、具备敏锐的市场洞察能力，较强的理解力和优秀内容策划能力4、良好的沟通表达能力5、工作经验中有成功的经验和案例6、高责任感及抗压力，对事业充满激情和追求7、具有C1驾照和自有车薪资福利：1.业内具有竞争力的薪资待遇，入职即缴纳五险一金；2.晋升机会明确：营销主管-营销经理-营销总监；3.表现优异者可享受一定股权激励；4.公司处于快速发展和扩张期，发展空间广大；4.年度的公司国内外旅游；5.良好的工作环境及氛围，暖心下午茶、生日会，公司聚会活动等；,民营  
品牌渠道营销经理,上海凯茜实业有限公司,1-2万,上海-长宁区,大专,3-4年经验,五险一金,原材料和加工,岗位职责：1、根据公司整体战略，协助营销总经理制定业务领域内的业务战略，并落实执行，确保营销目标达成；2、在营销总经理的领导下，建立、健全各项营销规章制度、政策，并推动营销管理工作的规范化、科学化和不断进步；3、负责各类销售指标的月度、季度、年度统计报表和报告的制作、编写，以及各项内部会议的记录；4、协助营销总经理做好下设各部门之间协调沟通等工作，并随时跟进销售人员日常业务的开展；5、销售团队的梯队建设和培养高素质的营销团队，建立培训、考核及激励机制；6、营销中心各项对外会议活动的统筹组织安排；7、领导安排的其他工作；任职要求：1、25-40岁，文秘、营销、管理等专业优先考虑；2、3年以上营销总助、销售运营支持岗位相关经验，从事于建材家居行业优先；3、有渠道管理和支持经验，熟练操作office办公软件；4、优秀的团队建设、管理和激励能力；5、具备高度的事业心和责任心、良好的团队合作精神，对工作充满激情，具有强烈的进取心，经理充沛；6、具备较强的理解能力和抗压能力，沟通能力以及协调能力；7、文笔书写功底能力好优先；8、有建材家居相关岗位者,民营  |  50-150人
市场营销专员,西安寿阳山骨灰墓园,5千-1万,杭州-萧山区,本科,3-4年经验,业务员,生活服务,市场营销经理岗位职责：1.根据安意战略发展制定公司的市场总体工作计划，提出市场推广等方面的实施方案；2.全面负责运营公司官网，自媒体等渠道的线上推广，引流获客；3.建立完善市场部工作流程以及制度规范；4.制定公司整体公关策略及危机公关的应对处理；5.组织和落实各项市场推广、品牌宣传和流量推广的规划、方案的实施、评估和总结；6.管理市场团队，并对团队成员和相关部门进行市场培训和指导。任职要求:：1.市场管理类或相关专业本科以上学历，擅长英语或意大利语者优先考虑；2.五年市场工作经验，在相关企业任职市场总监三年以上，具有家装、奢侈品行业的从业背景优先；3.具有敏感的商业和市场意识，分析及解决问题能力强，具有资源整合和业务推进能力；4.具备良好的沟通合作技巧及丰富的团队建设经验。5.有较强的的市场感知能力，能敏锐的把握市场动态、市场方向的能力6.有一定的传统媒体和网络媒体资源，能够充分整合并利用；补充说明：工作时间：周一至周五9：00-18：00/周六上午（9：00-12：00）薪资及调薪机制：底薪+年终奖+分红，每年三月份考核上一年综合表现，根据评级高低调薪。,民营  |  50-150人
整合营销负责人 (MJ006850),广州市钱大妈农产品有限公司,3-3.5万,湖州,大专,3-4年经验,营销策略,快速消费品(食品、饮料、化妆品),"岗位职责：1、	编制相应的市场开发计划、审核并执行2、	定期组织开展市场调研工作，实时掌握市场动态，完成市场分析并制定相应的市场策略3、	编制市场拓展各项费用预算，并控制相关费用的支出4、	目标市场的谈判与合作5、	团队建设与管理",民营  |  5000-10000人
网络营销主管,昆明市官渡区解药服装经营部,1-1.2万,深圳-龙岗区,大专,3-4年经验,运营,服装/纺织/皮革,1：根据营销4P策略，策划营销方案，并且推进落地2：依据品牌CIS系统，进行品牌塑造，包括传播、用户培育与管理、品牌应用、活动等3：管理官网、公众号等官方传播平台4：根据业务需要，制定站外推广计划并且推进实施5：策划公司的活动，比如招商会，市场调研，新品发布等,民营  |  150-500人
营销经理,青岛合力嘉环保建材集团有限公司,10-15万/年,南充,大专,5-7年经验,五险一金,建筑/建材/工程,岗位要求：1、5年以上房地产行业销售工作经验，具有3年同岗位管理经验；2、熟悉房地产开发相关流程和制度，具备一定的建筑及地产行业基础知识，熟悉房地产市场，熟悉营销推广过程，熟悉房地产供求特征和发展趋势；3、对于土地、住宅、商铺市场有系统研究和分析，对市场敏感度高，有专业经验和研究方法，具有把握行业市场动态和市场方向的能力，具有战略思维；4、对项目的研制、定位和规划设计有独特思考角度，对全盘营销工作有深刻认知并有独到见解；5、优秀的团队建设经验，团队管理能力强，善于协调营销团队的工作，较强的沟通能力、协调能力、计划与执行能力；任职资格：1、负责组织修改及审核开发项目的市场调研报告、可行性报告、项目市场定位方案和营销策划方案、销售定价方案、付款方式、项目营销费用等；2、负责设置销售目标、销售模式、销售战略、销售预算和奖励计划；3、负责市场划分和建立科学、合理的营销网络；4、建立和管理销售队伍，负责合理进行内部考核与分配，建立切实有效的激励机制，规范销售流程，完成销售目标；5、负责向主管领导及公司相关领导等进行部门工作汇报，提出工作中存在的问题及解决方案等,民营  |  50-150人
网络营销（室内办公，无需外出）,武汉毫厘企业管理有限公司,4-7千,天津-武清区,大专,1年经验,周末双休,中介服务,年龄：25-40周岁性别：不限学历：大专及以上工作内容：全力完成公司的销售指标和跟进计划，负责指定区域的市场调研，开发，客户维护和销售等工作，管理好销售团队，带领队拓展业务。1.搜集与寻找潜在客户，建立客户维护和潜在客户跟进表2.制定自己的工作目标跟进计划，并按计划跟进3.熟悉产品知识，和工作流程。建立公司专业负责的良好形象4.学习并掌握有效的工作技巧，掌握收集信息渠道，建立自己在区域内的关系网。5.有市场开拓能力和团队精神，有仪器仪表设备销售经验优先考虑。6.沟通能力比较强。基本要求：有激情、勤奋、吃苦耐劳、性格开朗、善于沟通，具有团队协作能力,民营  |  少于50人
市场营销专员,集邦咨询顾问（深圳）有限公司,8千-1.2万・13薪,湖州,大专,3-4年经验,市场营销,电子技术/半导体/集成电路,"岗位职责：1、	编制相应的市场开发计划、审核并执行2、	定期组织开展市场调研工作，实时掌握市场动态，完成市场分析并制定相应的市场策略3、	编制市场拓展各项费用预算，并控制相关费用的支出4、	目标市场的谈判与合作5、	团队建设与管理",外资（非欧美）  |  50-150人
市场营销专员,大连安洋国际物流有限公司,8千-1.5万・13薪,湖州,大专,3-4年经验,经销商,交通/运输/物流,"岗位职责：1、	编制相应的市场开发计划、审核并执行2、	定期组织开展市场调研工作，实时掌握市场动态，完成市场分析并制定相应的市场策略3、	编制市场拓展各项费用预算，并控制相关费用的支出4、	目标市场的谈判与合作5、	团队建设与管理",民营  |  少于50人
餐饮营销经理,昆明凯碧餐饮管理有限公司,7千-1万,武汉,大专,5-7年经验,餐饮,餐饮业,岗位职责：1、根据公司总体战略，结合市场情况制定销售策略与规划并组织实施，达成销售目标；2、根据既有的销售体系，完善优化销售体系和流程；3、制定销售费用的预算，控制销售成本，提高销售利润；4、负责销售部大型推广和其他临时性推广活动的审批；5、负责销售部的组织架构构建、调整和人员管理；6、深入了解本行业，把握销售信息，为企业提供业务发展和价格定位的战略依据；任职要求：1、饮料一线品牌销售高管工作经验，5年以上销售管理岗位工作经验；2、有敏锐的市场意识、应变能力、领导能力和独立开拓市场的能力，学习能力强；逻辑性强和良好的语言表达能力；3、具备一定市场人脉资源和市场理解力；4、年富力强，适应出差，有较强的目标意识；,民营  |  1000-5000人
市场营销专员,南昌洪福人文纪念有限责任公司,8-10万/年,长沙,本科,3-4年经验,五险一金,生活服务,职位描述：1、负责所在地的经销商相关产品的售卖与服务，完成公司制定的销售目标；2、宣传推广公司产品、品牌，负责新客户的拓展和开发，并维护和管理老客户；3、负责客户营销方案的制作和提报，以及销售合同的谈判、签订、收款；4、组织所在地用户和经销商的培训及活动。职位要求：1、本科及以上学历，有互联网、汽车、媒体等相关行业销售经验；2、诚实有信，做事坚持原则，有责任心，吃苦耐劳；3、热爱销售工作，有激情，积极主动，有强烈的团队协作意识；4、有创业心态，愿意投入付出。,合资  |  50-150人
营销主管（硕士）,汇润电气有限公司,7千-1万,深圳-宝安区,本科,3-4年经验,五险一金,汽车,营销总监岗位职责：1.负责奢侈品宠物项圈的市场分析和竞争对手调研工作；2.负责奢侈品宠物项圈的客户调研和价值曲线绘制工作；3.负责奢侈品宠物项圈的线下渠道拓展工作；4.负责奢侈品宠物项圈的小红书营销策划工作；5.负责侈品宠物项圈的的天猫和抖音店铺的运营工作；6.负责侈品宠物项圈的产品定位和定价工作；7.参与侈品宠物项圈的设计工作。任职要求：1.有强烈的企图心，愿意在一年内赚100万以上；2.对国内宠物市场有深刻的洞察和理解；3.具有线下宠物店资源或者线上宠物用品运营经验；4.能够参与宠物用品的调研、定位和产品研发环节。5.本科及以上学历，年龄在30-60之间。,民营  |  150-500人
营销策划总监,苏州希盟科技股份有限公司,4-7万,湖州,大专,5-7年经验,五险一金,仪器仪表/工业自动化,"岗位职责：1、	编制相应的市场开发计划、审核并执行2、	定期组织开展市场调研工作，实时掌握市场动态，完成市场分析并制定相应的市场策略3、	编制市场拓展各项费用预算，并控制相关费用的支出4、	目标市场的谈判与合作5、	团队建设与管理",民营  |  150-500人
营销专员,成都高新区社事投资发展有限公司,5-7千,东莞-东城区,本科,8-9年经验,推广,政府/公共事业,主要职责：整合企业产品、品牌、产能、技术、市场、组织、人力、资金、政策、管理等资源，经营国内/国际的销售，实现国内/国际市场营销战略目标；执行年度目标计划，确保销售、回款和利润指标的实现，保持公司优质经营和持续发展。1．在总经理的领导下，主持国内/国际营销公司的全局工作和日常工作。2．分析竞争环境和市埸策略，制定国内/国际市场总体营销规划并获得评审通过。3．制定国内/国际销售年度营销计划并获得评审通过。4．依据年度计划组织、指导各下属部门制定其年度计划并批准实施。5．对各部门营销计划实施督导考核，实行目标管理和计划管理，以确保计划目标达成。6．整合企业资源，与生产、技术等相关部门沟通协作，以支持国内/国际市场营销目标的达成。7．对国内/国际营销费用进行预算并将费用指标分解到人，费用控制在预算内。8．负责督导全国/国际市埸的销售与推广、促销工作。9．对各部门的应收款、回款、对帐、销售预测、库存等业务活动进行检查和控制。10.组织新市埸的开发与管理。11．做好客户档案管理与客户资料分析，实施客户分级管理。12．参与重大销售活动和重要客户的谈判。13．定期或不定期地深入市场一线巡视检查工作，做好市场调查研究和重点客户拜访工作。14．做好每个财年的货款结算结清工作，预防呆赖死账风险。15．制定国内公司的组织架构和部门职能、岗位职责。16．组织制定公司营销部门的各类管理规章制度，对运作流程进行优化。18．加强对制度、流程执行的督导考核。19．组织月度例会工作，通过例会管理，进行检查、评估、指导和考核。20．制定合理的分配体系，有效激励团队。21．加强营销团队资源的建设和管理。22．加强对中层营销管理团队的管理。招聘条件：1、本科及以上学历，年g30-45周岁，市场营销管理、工商企业管理、机械类等相关专业2、六年以上大中型企业中高层管理经验，四年以上同等职位管理经验3、熟练掌握企业战略、营销管理、人力资源、财务、信息管理的方法和技能4、熟悉企业的内外部经营环境，对国家有关经济工作的政策、方针、法律有一定的了解。5、有公司中长期发展战略规划能力和组织实施的能力6、有较强的决策、计划、组织、领导、协调能力注：一眼万年有提成，实行企业分红，条件优异者可与公协商其它条件,国企  |  50-150人
营销总监,佛山市贝鲁门窗有限公司,3-5万,广州-黄埔区,高中,无需经验,营销总监,家具/家电/玩具/礼品,一、岗位职责：1、对有办理分期业务意向的客户介绍专项分期业务；2、协助开展活动宣传、收集整理专项分期所需申请资料、需补办的其他申请资料、专项分期贷后管理相关资料；3、具备一定的装修公司资源，能够将资源合理转化；4、负责营销业务的市场调研工作，推广银行相关产品；5、负责维护银行良好的品牌形象，促进银行分期业务的健康发展；6、具有一定的从事银行专项分期业务工作经验二、岗位要求1、高中及以上学历，专业不限，有家装、家居建材、楼盘物业等资源或驻店销售、地推销售、场景消费金融销售、行业SAAS等背景优先；2、对金融行业感兴趣，执行力较强，服务意识强，性格外向，善于沟通以及良好的团队意识；,民营  
营销策划专员,南昌市宝地科技咨询有限公司,7千-1万,重庆-璧山区,大专,2年经验,市场营销,专业服务(咨询、人力资源、财会),薪资待遇：1、底薪+高额佣金提成+业绩奖励，上不封顶；2、五险+各项节日、礼金福利；3、异地项目安排住宿，有异地补贴；4、另有项目分红、股权激励等长期激励政策。岗位职责：1、根据公司制定的销售目标，负责销售任务的完成；2、负责制定项目营销策略、铺排任务和落实执行动作，并协调组织、进行实施；3、负责拟定、修改、完善销售说辞；4、负责项目人员搭建、团队建设，定期进行业务技能培训，提升团队作战能力；5、对下属的能力和工作情况进行评价，及时给予必要的指导和支持；6、负责项目现场管理，对销售流程等重要事项进行把控，处理各类突然事件；7、负责对项目营销费用进行管控；8、负责维护各方利益（甲方、物业、分销渠道等）的合作关系；9、负责协调本部门和公司其他部门的关系；10、负责公司营销例会汇报工作。任职资格：1、大学专科及以上学历，30-38岁，男女不限；2、2年及以上同岗位工作经验，接受跨区域调动；3、有较强的市场敏锐度和市场分析能力；4、具有突出的销售能力、领导能力和管理能力，能够激发团队销售潜能，完成销售任务；5、较强的人际沟通、协调能力，分析和解决问题能力；6、有工作激情，有责任心，抗压能力强，执行力强；7、有包销、风代项目经验者优先，有同时管理2个或以上商业项目经验者优先。,民营  |  50-150人
营销策划总监,苏州希盟科技股份有限公司,4-7万,湖州,大专,3-4年经验,五险一金,仪器仪表/工业自动化,"岗位职责：1、	编制相应的市场开发计划、审核并执行2、	定期组织开展市场调研工作，实时掌握市场动态，完成市场分析并制定相应的市场策略3、	编制市场拓展各项费用预算，并控制相关费用的支出4、	目标市场的谈判与合作5、	团队建设与管理",民营  |  150-500人
营销管理资深主管,国科量子通信网络有限公司,1.5-2.5万・15薪,昆明-呈贡区,大专,3-4年经验,营销管理,通信/电信/网络设备,1、专业人员职位，在上级的领导和监督下定期完成量化的工作要求，并能独立处理和解决所负责的任务；2、协助上级管理、协调市场，跟踪并监察各项市场营销计划的执行；3、熟悉建筑行业，有良好的人脉资源和社交能力；任职资格：1、大专以上学历，营销、管理类专业为佳；2、熟悉建筑行业，有销售和管理经验者优先；3、具备思维活跃、有积极进取的精神及接受挑战的性格；4、为人诚实、正直，性格开朗、责任心强，擅长与人沟通；5、有一定的组织协调能力，能承担和突破工作压力，是很好的时间管理者和自我任务驱动者；6、性格外向，能熟练驾驶；,国企  |  150-500人
营销专员,北京迈R医疗技术发展有限公司,4-8千,咸阳-秦都区,本科,5-7年经验,五险一金,医疗设备/器械,岗位职责：1、负责制定销售目标和销售战略；2、负责销售中心的营销活动；3、负责组织拟订产品价格体系；4、负责对销售中心人员进行考评及销售队伍建设；5、实现并完成销售任务。任职资格：1、本科以上学历，5年以上医疗器械类、特种车类相关销售管理工作经验；2、具有较强的学习动手能力、沟通能力及责任心，爱好销售，具备良好的团队合作意识；3、熟悉招投标相关的法律法规及招投标流程；4、熟练使用Office办公软件，熟练驾驶，有一定的医学常识，汽车常识5、有客户资源,民营  |  150-500人
